Front,Back,Extra,Tags
"A real-time notification system must push events from Azure services (Blob Storage, Event Grid, custom applications) to thousands of subscribers with automatic retry, dead-lettering, and filtering per subscriber based on event attributes. Events must be delivered within 1 second.<br><br>A) Azure Event Grid with event subscriptions and filters<br>B) Azure Service Bus with topic subscriptions<br>C) Azure Event Hubs with consumer groups","A) Azure Event Grid with event subscriptions and filters","Event Grid purpose-built for reactive event distribution with subsecond latency. Native integration with 20+ Azure services. Advanced filtering per subscription. Built-in retry and dead-letter. Service Bus for reliable messaging, not reactive event distribution. Event Hubs for high-throughput ingestion, not fan-out distribution.","AZ-305 Infrastructure EventArchitecture"
"A web API serves 1 million requests per day with response data rarely changing. 80% of requests query the same 100 products. API response time must be <50ms. Backend database query time averages 200ms. Solution must minimize database load.<br><br>A) Azure Cache for Redis with cache-aside pattern and sliding expiration<br>B) Azure API Management with response caching policy<br>C) Application-level in-memory caching","A) Azure Cache for Redis with cache-aside pattern and sliding expiration","Redis provides distributed cache accessible across multiple API instances (unlike in-memory cache). Cache-aside pattern queries cache first, reads DB on miss, populates cache. Sliding expiration keeps hot data cached. APIM response caching limited to gateway level (doesn't reduce backend calls from multiple gateways). In-memory cache not shared across instances.","AZ-305 Infrastructure CachingSolution"
"A microservices application stores configuration (feature flags, connection strings, service endpoints) that changes weekly. 30 services must refresh configuration every 5 minutes without redeployment. Configuration must support versioning and rollback. Secrets must integrate with Key Vault.<br><br>A) Azure App Configuration with feature flags and Key Vault references<br>B) Azure Key Vault with secret versioning<br>C) Azure Storage with JSON configuration files","A) Azure App Configuration with feature flags and Key Vault references","App Configuration provides centralized configuration with dynamic refresh (no redeployment). Feature flag management with targeting rules. Key Vault references for secrets (not stored in App Config). Configuration versioning and point-in-time snapshot. Key Vault for secrets only, not app configuration. Storage files require manual refresh logic.","AZ-305 Infrastructure ApplicationConfiguration"
"A CI/CD pipeline deploys containerized applications to 10 AKS clusters across regions. Deployments must be GitOps-based with automatic reconciliation of cluster state with Git repository. Configuration drift must be detected and corrected automatically. Solution must support progressive delivery strategies.<br><br>A) Azure DevOps with Argo CD and Flux<br>B) Azure Pipelines with kubectl commands<br>C) GitHub Actions with Helm","A) Azure DevOps with Argo CD and Flux","GitOps tools (Argo CD, Flux) continuously monitor Git repository and reconcile cluster state (automatic drift correction). Support progressive delivery (canary, blue/green). Azure Pipelines with kubectl is imperative (no automatic reconciliation). GitHub Actions with Helm lacks continuous reconciliation and drift detection.","AZ-305 Infrastructure ApplicationDeployment"
"A global web application requires intelligent routing of users to the nearest healthy Azure region based on latency, with automatic failover during regional outages. Solution must support priority-based routing with primary region preferred unless unhealthy.<br><br>A) Azure Traffic Manager with performance routing and endpoint monitoring<br>B) Azure Front Door with priority-based routing<br>C) Azure Load Balancer with cross-region support","A) Azure Front Door with priority-based routing","Front Door provides priority-based routing (prefer primary region) with automatic failover based on health probes. SSL offload, WAF, and CDN capabilities included. Traffic Manager uses DNS (slower failover detection). Standard Load Balancer regional only (cross-region LB limited scenarios).","AZ-305 Infrastructure NetworkSolutions"
"An Azure environment with 200 VMs across 10 virtual networks in hub-spoke topology requires centralized egress filtering with threat intelligence and deep packet inspection. All internet-bound traffic must be inspected with logging. Solution must support automatic scaling during traffic spikes.<br><br>A) Azure Firewall Premium with threat intelligence and forced tunneling in hub VNet<br>B) Network Security Groups with service tags<br>C) Network Virtual Appliance with UDRs","A) Azure Firewall Premium with threat intelligence and forced tunneling in hub VNet","Azure Firewall in hub VNet with UDRs in spokes forces all egress through firewall (hub-spoke topology). Premium tier provides threat intelligence, TLS inspection, and IDPS. Auto-scales to handle traffic spikes. NSGs stateless filtering, no deep packet inspection. NVA requires manual scaling and management.","AZ-305 Infrastructure NetworkSecurity"
"A hybrid application requires private connectivity between on-premises datacenter and 50 Azure VNets across 3 regions with transitive routing. On-premises should route to any VNet through single connection. Solution must support 5 Gbps aggregate throughput and BGP route exchange.<br><br>A) ExpressRoute with Virtual WAN hub and spoke<br>B) Site-to-site VPN with Virtual Network Gateway in each VNet<br>C) ExpressRoute with VNet peering mesh","A) ExpressRoute with Virtual WAN hub and spoke","Virtual WAN provides transitive routing across hubs and spokes (on-prem routes to any VNet through WAN hub). Single ExpressRoute connection to WAN hub reaches all spokes. BGP support for dynamic routing. Multiple VPN gateways don't support transitive routing. VNet peering mesh requires full mesh (N*(N-1)/2 peerings, not scalable).","AZ-305 Infrastructure NetworkSolutions"
"A latency-sensitive application requires load balancing across VMs in multiple availability zones with session affinity (same client to same backend). Health probes must check application-level health every 5 seconds. Solution must support both inbound and outbound NAT.<br><br>A) Azure Standard Load Balancer with zone-redundant frontend and health probes<br>B) Azure Application Gateway with cookie-based affinity<br>C) Azure Traffic Manager with geographic routing","A) Azure Standard Load Balancer with zone-redundant frontend and health probes","Standard Load Balancer supports zone redundancy, session affinity (source IP), configurable health probes (5-second interval), and outbound NAT. Low latency (Layer 4). Application Gateway operates at Layer 7 (higher latency). Traffic Manager DNS-based (unsuited for session affinity and zone-level load balancing).","AZ-305 Infrastructure LoadBalancing"
"A web application on App Service requires private access to Azure SQL Database, Storage, and Key Vault without internet exposure. Application must resolve Azure service private IPs using DNS. VNet integration required.<br><br>A) App Service VNet integration with private endpoints and Azure Private DNS zones<br>B) App Service with service endpoints<br>C) Azure Application Gateway with backend pools","A) App Service VNet integration with private endpoints and Azure Private DNS zones","App Service VNet integration enables private connectivity. Private endpoints assign private IPs to SQL, Storage, Key Vault. Azure Private DNS zones provide name resolution to private IPs (e.g., mydb.database.windows.net resolves to 10.0.1.5). Service endpoints don't prevent public IP exposure. Application Gateway for inbound traffic, not outbound private connectivity.","AZ-305 Infrastructure NetworkSolutions"
"An Azure SQL Database migration from on-premises SQL Server 2017 (5 TB, 100 databases) requires minimal downtime (<5 minutes), schema compatibility validation, and automatic rollback capability. Migration must preserve logins, jobs, and alerts.<br><br>A) Azure Database Migration Service with online migration and Azure SQL Managed Instance<br>B) Azure Data Factory with incremental copy to Azure SQL Database<br>C) SQL Server backup/restore to Azure SQL Database","A) Azure Database Migration Service with online migration and Azure SQL Managed Instance","DMS online migration provides near-zero downtime with continuous replication. Managed Instance supports 100% SQL Server compatibility (jobs, logins, alerts). Migration assessment validates compatibility. Cutover supports rollback. Azure SQL Database doesn't support SQL Agent jobs. Backup/restore significant downtime (5 TB).","AZ-305 Infrastructure Migrations"
"A data center decommissioning requires migrating 500 VMs (Windows, Linux, various applications) to Azure within 3 months. Migration must assess dependencies, group workloads, and perform discovery. Solution must minimize refactoring and support wave-based migration.<br><br>A) Azure Migrate with dependency analysis and replication appliance<br>B) Azure Site Recovery with recovery plans<br>C) Azure Data Box with VM disk transfer","A) Azure Migrate with dependency analysis and replication appliance","Azure Migrate provides assessment (dependency mapping, grouping, sizing), agentless discovery, and Azure Site Recovery-based replication. Supports wave-based migration with testing. Aligns with Cloud Adoption Framework. ASR component of Migrate but lacks assessment. Data Box for data transfer, not VM migration.","AZ-305 Infrastructure Migrations"
"A web application with 10 TB SQL Database, 50 TB Blob Storage, and 20 VMs must migrate to Azure with <1 hour downtime. Network bandwidth to Azure is 1 Gbps. Solution must optimize transfer time and minimize costs.<br><br>A) Azure Data Box for initial data transfer with DMS/ASR for final sync<br>B) ExpressRoute with parallel data transfer<br>C) Azure Site Recovery for all workloads","A) Azure Data Box for initial data transfer with DMS/ASR for final sync","Data Box physically transfers 60 TB offline (faster than 1 Gbps network). Database Migration Service and Site Recovery perform final incremental sync during cutover (minimizes downtime to <1 hour). ExpressRoute requires time to provision and doesn't reduce total transfer time significantly. ASR alone slow for 60 TB initial replication over internet.","AZ-305 Infrastructure Migrations"