Front,Back,Extra,Tags
"Your application must cache frequently accessed data with sub-millisecond latency. Cache entries must expire after 10 minutes and support automatic failover across regions.<br><br>A) Azure Cache for Redis Premium tier with geo-replication and TTL settings<br>B) Azure Table Storage with cached queries<br>C) In-memory caching in App Service instances","A) Azure Cache for Redis Premium tier with geo-replication and TTL settings","Redis Premium provides sub-millisecond latency, geo-replication for failover, and per-key TTL settings. Table Storage has higher latency. In-memory caching in App Service doesn't provide cross-instance consistency or failover. Redis Premium delivers enterprise-grade caching with high availability and flexible expiration policies.","AZ-204 Storage Redis"
"An application uses Azure Cache for Redis to store session state for a web farm. Sessions must survive cache node failures without data loss.<br><br>A) Configure Redis data persistence with AOF (Append Only File) or RDB snapshots<br>B) Use Standard tier without persistence<br>C) Store sessions in Blob Storage instead of Redis","A) Configure Redis data persistence with AOF (Append Only File) or RDB snapshots","Redis persistence (AOF for durability, RDB for backups) writes data to disk, enabling recovery after failures. Standard tier doesn't prevent data loss from failures. Moving to Blob Storage loses sub-millisecond performance. Persistence ensures cache durability for critical data like sessions.","AZ-204 Storage Redis"
"Your web API must respond to CORS preflight requests from https://app.contoso.com allowing POST requests with custom headers.<br><br>A) Configure CORS policy in App Service or API Management with allowed origins, methods, and headers<br>B) Add Access-Control-Allow-Origin header manually in application code for all responses<br>C) Disable CORS validation in browser","A) Configure CORS policy in App Service or API Management with allowed origins, methods, and headers","Platform-level CORS configuration handles preflight OPTIONS requests automatically with proper headers. Manual header setting in code doesn't handle preflight correctly. Disabling browser validation isn't possible. Declarative CORS configuration ensures proper preflight handling and security.","AZ-204 Security CORS"
"An App Service application must authenticate users via Azure AD and also accept requests with API keys for legacy clients.<br><br>A) Enable App Service Authentication with Azure AD provider and implement custom API key middleware<br>B) Use Azure AD authentication only with guest accounts for legacy clients<br>C) Disable built-in authentication and implement custom solution","A) Enable App Service Authentication with Azure AD provider and implement custom API key middleware","App Service Authentication handles Azure AD flows; custom middleware can validate API keys for requests bypassing Easy Auth. Guest accounts don't solve API key requirement. Custom-only solution duplicates platform features. Hybrid approach combines platform authentication with custom logic for legacy support.","AZ-204 Security Authentication"
"Your Azure SQL Database must scale to handle unpredictable workloads with automatic performance adjustment without manual intervention.<br><br>A) Configure serverless compute tier with auto-pause and auto-scale<br>B) Use vCore provisioned tier with manual scaling<br>C) Implement DTU-based tier with fixed resources","A) Configure serverless compute tier with auto-pause and auto-scale","Serverless tier automatically scales compute based on workload and pauses during inactivity for cost savings. vCore/DTU require manual scaling. Serverless is ideal for unpredictable workloads with intermittent usage patterns requiring automatic scale and cost optimization.","AZ-204 Storage AzureSQL"
"An application queries Azure SQL Database across multiple tables with complex joins. Query performance degrades with data growth. You must optimize read performance without changing code.<br><br>A) Create non-clustered indexes on foreign key and WHERE clause columns<br>B) Scale up database tier permanently<br>C) Add read replicas for all queries","A) Create non-clustered indexes on foreign key and WHERE clause columns","Indexes dramatically improve query performance by reducing scans. Scaling up increases cost without addressing query efficiency. Read replicas help scale out but indexes are primary optimization. Strategic indexing on join and filter columns optimizes query execution plans without code changes.","AZ-204 Storage AzureSQL"
"Your application must execute long-running data import jobs (30+ minutes) against Azure SQL Database without blocking other transactions.<br><br>A) Use Azure SQL Database elastic jobs or Azure Data Factory with batch processing<br>B) Execute import in application code with synchronous calls<br>C) Use stored procedure with transaction isolation","A) Use Azure SQL Database elastic jobs or Azure Data Factory with batch processing","Elastic jobs and Data Factory provide orchestrated, resilient batch processing separate from application. Synchronous code blocks application. Stored procedures run in database engine (still block). Elastic jobs/Data Factory enable long-running operations with retry, scheduling, and monitoring.","AZ-204 Storage AzureSQL"
"An application must store structured configuration data with fast point-reads by composite key (partitionKey + rowKey). Data access is infrequent but must be very low cost.<br><br>A) Azure Table Storage with partition key design<br>B) Azure SQL Database with clustered index<br>C) Cosmos DB with composite partition key","A) Azure Table Storage with partition key design","Table Storage provides extremely low-cost NoSQL storage with fast point-reads via partition/row keys. SQL Database has higher cost for infrequent access. Cosmos DB is more expensive than Table Storage for simple key/value scenarios. Table Storage optimizes cost for infrequent structured data access.","AZ-204 Storage TableStorage"
"Your application must share files across multiple Azure VMs and App Service instances with SMB protocol support and AD authentication.<br><br>A) Azure Files with SMB shares and Azure AD Domain Services integration<br>B) Blob Storage with NFS protocol<br>C) Shared disk attached to VMs","A) Azure Files with SMB shares and Azure AD Domain Services integration","Azure Files provides fully managed SMB shares with Azure AD DS authentication mountable by Windows/Linux VMs and App Service. Blob NFS is for Linux-specific scenarios without SMB. Shared disks have attachment limits. Azure Files delivers cloud-native SMB file sharing with identity integration.","AZ-204 Storage AzureFiles"
"An API Management instance must expose version 1 and version 2 of an API simultaneously, routing based on URL path (/v1/ vs /v2/).<br><br>A) Configure API versioning with path-based versioning scheme in API Management<br>B) Deploy separate API Management instances for each version<br>C) Use query string parameter for version selection","A) Configure API versioning with path-based versioning scheme in API Management","API Management versioning supports path-based schemes (e.g., /api/v1/, /api/v2/) with single API definition. Multiple instances increase cost and complexity. Query strings are less RESTful than path-based. Built-in versioning enables side-by-side version deployment with flexible routing.","AZ-204 Integration APIManagement"
"Your API in API Management must test breaking changes safely before promoting to production while maintaining the same version number.<br><br>A) Create API revision in API Management and test before making it current<br>B) Create new API version for testing<br>C) Deploy changes directly to production API","A) Create API revision in API Management and test before making it current","API revisions enable safe changes within same version without affecting consumers (accessed via revision identifier). Versions are for breaking changes with different version numbers. Direct production deployment is risky. Revisions provide safe iteration with promotion workflow for non-breaking changes.","AZ-204 Integration APIManagement"
"An API Management solution must group related APIs with access control and subscription keys specific to different customer tiers (free, premium).<br><br>A) Configure API Management products with API associations and subscription requirements<br>B) Use separate API Management instances per tier<br>C) Implement access control in backend APIs","A) Configure API Management products with API associations and subscription requirements","Products group APIs with unified access policies, subscriptions, and rate limits for different customer tiers. Multiple instances increase overhead. Backend access control bypasses API gateway capabilities. Products provide business-oriented API grouping with tier-based access and billing.","AZ-204 Integration APIManagement"
"Your application must implement a stateful workflow coordinating multiple services with checkpointing and automatic retries over several hours.<br><br>A) Use Logic Apps with built-in connectors and retry policies<br>B) Use Azure Functions with manual state management in storage<br>C) Use Service Bus with message deferral","A) Use Logic Apps with built-in connectors and retry policies","Logic Apps provides visual workflow orchestration with 400+ connectors, built-in retry policies, and automatic state management. Functions require custom orchestration code (Durable Functions is better but not listed). Service Bus handles messaging not orchestration. Logic Apps simplifies complex workflow automation.","AZ-204 Integration LogicApps"
"An Azure Container Registry must prevent anonymous image pulls and enforce authentication for all image operations.<br><br>A) Disable public network access and use private endpoint or configure Azure AD authentication<br>B) Use public access with IP filtering only<br>C) Share registry admin credentials with teams","A) Disable public network access and use private endpoint or configure Azure AD authentication","Private endpoints eliminate public access; Azure AD authentication provides identity-based access control. IP filtering alone doesn't enforce authentication. Admin credentials should not be shared (security risk). Private networking + Azure AD delivers secure, identity-based registry access.","AZ-204 Compute Containers"
"Your container registry must replicate images across multiple regions for low-latency pulls and disaster recovery.<br><br>A) Configure ACR geo-replication in Premium tier<br>B) Manually copy images to registries in each region<br>C) Use Azure Traffic Manager with single registry","A) Configure ACR geo-replication in Premium tier","ACR geo-replication (Premium tier) automatically syncs images across regions with regional endpoints for fast pulls. Manual copying is complex and error-prone. Traffic Manager doesn't replicate data. Geo-replication provides managed multi-region image distribution with regional access.","AZ-204 Compute Containers"
"An application must implement Redis cache-aside pattern with fallback to database for cache misses and populate cache with 5-minute expiration.<br><br>A) Check cache for data; if miss, query database, populate cache with TTL, return data<br>B) Query database always and update cache asynchronously<br>C) Use cache only without database fallback","A) Check cache for data; if miss, query database, populate cache with TTL, return data","Cache-aside pattern: application checks cache first, loads from database on miss, populates cache with TTL. Always querying database negates cache benefits. Cache-only fails when data missing. Cache-aside balances performance (cache hits) and data availability (database fallback) with freshness (TTL).","AZ-204 Storage Redis"
"Your Function App must implement fan-out/fan-in pattern to process 100 parallel tasks and aggregate results.<br><br>A) Use Durable Functions with orchestrator calling activity functions in parallel and gathering results<br>B) Use queue-triggered functions with manual coordination<br>C) Use timer trigger with batching logic","A) Use Durable Functions with orchestrator calling activity functions in parallel and gathering results","Durable Functions orchestrator can call multiple activity functions in parallel (WhenAll) and aggregate results with built-in state management. Queue-based coordination is complex. Timer batching doesn't provide orchestration. Durable Functions provides declarative fan-out/fan-in with automatic state persistence.","AZ-204 Compute Functions"
"An application must store and retrieve secrets, keys, and certificates with versioning and access audit logs for compliance.<br><br>A) Use Azure Key Vault with version management and diagnostic logging to Log Analytics<br>B) Store secrets in environment variables<br>C) Use Azure App Configuration for all secret types","A) Use Azure Key Vault with version management and diagnostic logging to Log Analytics","Key Vault provides versioned secret/key/certificate storage with full access logging and built-in audit capabilities. Environment variables lack versioning and auditing. App Configuration isn't designed for secrets (use Key Vault reference). Key Vault is purpose-built for secret lifecycle management with compliance features.","AZ-204 Security KeyVault"
"Your API must validate OAuth 2.0 access tokens issued by Azure AD B2C with custom claims for role-based authorization.<br><br>A) Configure JWT Bearer authentication with Azure AD B2C issuer and validate custom claims in authorization policies<br>B) Accept tokens without validation<br>C) Use API keys instead of OAuth tokens","A) Configure JWT Bearer authentication with Azure AD B2C issuer and validate custom claims in authorization policies","JWT middleware validates B2C tokens (signature, issuer, expiration); authorization policies evaluate custom claims for role decisions. No validation is insecure. API keys lack B2C integration. Token validation + custom claims provide secure identity-based authorization with Azure AD B2C.","AZ-204 Security Authentication"
"An application must query Azure Storage Queue messages without removing them to inspect and conditionally process later.<br><br>A) Use PeekMessages operation to view messages without dequeue<br>B) Use GetMessages with zero visibility timeout<br>C) Dequeue and re-queue messages manually","A) Use PeekMessages operation to view messages without dequeue","PeekMessages retrieves messages for inspection without affecting queue state or visibility. GetMessages dequeues (even with zero timeout). Manual dequeue/re-queue changes message state. Peek provides non-destructive queue inspection for conditional processing scenarios.","AZ-204 Integration StorageQueue"
"Your App Service must connect to Azure SQL Database using private IP without traversing the internet, even within Azure.<br><br>A) Configure VNet integration for App Service and Private Link/Private Endpoint for SQL Database<br>B) Use firewall rules allowing Azure services<br>C) Use public endpoint with TLS encryption","A) Configure VNet integration for App Service and Private Link/Private Endpoint for SQL Database","VNet integration connects App Service to VNet; Private Link exposes SQL Database on private IP in VNet (no internet). Firewall rules still use public endpoints. TLS encrypts but uses public routing. Private Link + VNet integration provides fully private connectivity over Microsoft backbone.","AZ-204 Security Networking"
"An application experiences intermittent timeouts connecting to Azure Storage. You need to implement retry logic with exponential backoff.<br><br>A) Configure Azure Storage SDK retry policy with exponential backoff strategy<br>B) Implement custom retry loop with Thread.Sleep<br>C) Increase operation timeout without retry logic","A) Configure Azure Storage SDK retry policy with exponential backoff strategy","Azure Storage SDK includes built-in retry policies with exponential backoff, jitter, and circuit breaker patterns. Custom retry loops are error-prone. Timeout increase doesn't address transient failures. SDK retry policies provide production-grade transient fault handling with configurable strategies.","AZ-204 Storage BlobStorage"